{
  "name": "Emergency Decision Rules",
  "description": "Use when applying validated ED decision rules to reduce unnecessary imaging or testing. Includes Ottawa ankle/knee rules, Canadian C-Spine rule, and the PERC rule.",
  "instructions": "# Emergency Decision Rules\n\n## Description\n\nThis skill provides structured guidance for common ED decision rules used to reduce unnecessary imaging or testing while maintaining safety. It supports accurate input collection, rule application, and risk interpretation.\n\n## Quick Reference\n\n| Tool | Use |\n|------|-----|\n| Ottawa Ankle Rules | Decide ankle or foot radiographs after ankle injury |\n| Ottawa Knee Rules | Decide knee radiographs after acute knee injury |\n| Canadian C-Spine Rule | Decide cervical spine imaging in alert trauma patients |\n| PERC Rule | Exclude PE in low-risk patients without D-dimer |\n\n## Interactive Mode (Lightweight)\n\n1. Confirm clinical context and intended rule.\n2. Collect required inputs and findings.\n3. Validate inclusion and exclusion criteria.\n4. Apply rule and present result.\n5. Provide safety caveats and next-step guidance.\n\n## Decision Rules\n\n- [Ottawa Ankle Rules](assets/ottawa-ankle.md)\n- [Ottawa Knee Rules](assets/ottawa-knee.md)\n- [Canadian C-Spine Rule](assets/canadian-cspine.md)\n- [PERC Rule](assets/perc-rule.md)\n\n## Safety and Limitations\n\n- Support tool only; not diagnostic or prescriptive.\n- Use local policies and clinical judgment.\n- Validate eligibility before applying each rule.\n\n## References\n\nSee: [references/emergency-decision-rules-sources.md](references/emergency-decision-rules-sources.md)\n",
  "suggested_prompts": [
    "Use Emergency Decision Rules for this scenario.",
    "Walk me through Emergency Decision Rules."
  ],
  "tags": [
    "emergency",
    "decision-rules",
    "ottawa-ankle",
    "ottawa-knee",
    "canadian-cspine",
    "perc",
    "imaging",
    "pe",
    "trauma",
    "clinical"
  ],
  "category": "clinical-calculators"
}
