{
  "name": "Well-Being Screening",
  "description": "Use when assessing subjective well-being or tracking recovery alongside symptom measures. Provides WHO-5 Well-Being Index with scoring and interpretation guidance.",
  "instructions": "# Well-Being Screening (WHO-5)\n\n## Description\n\nThis skill provides the WHO-5 Well-Being Index, a brief measure of positive well-being that complements symptom-focused screening.\n\n**Permission:** WHO-5 is free of charge and does not require permission for use.\n\n## Quick Reference\n\n| Assessment | Items | Time | Purpose | Score Range |\n|------------|-------|------|---------|-------------|\n| **WHO-5** | 5 | <1 min | Well-being screening | 0-25 raw (x4 to 0-100) |\n\n## Assessment Tool\n\n- **WHO-5**: [assets/who-5.md](assets/who-5.md)\n\n## Interactive Administration (Optional)\n\nUse this mode when the clinician says \"start\" or \"administer\" the WHO-5.\n\n1. Confirm readiness and explain the past 2 weeks time frame plus the 0-5 response scale.\n2. Ask one item at a time (verbatim from the asset file) and wait for a response before continuing.\n3. Accept numeric or verbal responses; if unclear or out of range, ask for clarification.\n4. Record each response, sum the raw score, and multiply by 4 to calculate the 0-100 index.\n5. Interpret results per the asset file guidance and suggest next steps if indicated.\n6. Offer a brief documentation summary if requested.\n\n## Documentation\n\nUse the template in the asset file.\n\n## References\n\n- Permission and scoring guidance: [references/permissions-and-scoring.md](references/permissions-and-scoring.md)\n",
  "suggested_prompts": [
    "Use Well-Being Screening for this scenario.",
    "Walk me through Well-Being Screening."
  ],
  "tags": [
    "wellbeing",
    "who-5",
    "screening",
    "mental-health"
  ],
  "category": "screening"
}
